{
  "kind": "home-sim-template",
  "id": "apt-2br",
  "name": "两居室",
  "source": "Luna 模板户型-原创-v1.2（2026-09-30）",
  "areaBasis": "centerline",
  "expected": {
    "areaBasis": "centerline",
    "rooms": [
      {
        "name": "主卧",
        "x": 0,
        "y": 0,
        "w": 3300,
        "d": 3900,
        "areaM2": 12.9
      },
      {
        "name": "次卧",
        "x": 3300,
        "y": 0,
        "w": 2700,
        "d": 3900,
        "areaM2": 10.5
      },
      {
        "name": "卫生间",
        "x": 6000,
        "y": 0,
        "w": 1800,
        "d": 2400,
        "areaM2": 4.3
      },
      {
        "name": "过道",
        "x": 6000,
        "y": 2400,
        "w": 1800,
        "d": 1500,
        "areaM2": 2.7
      },
      {
        "name": "厨房",
        "x": 7800,
        "y": 0,
        "w": 1800,
        "d": 3900,
        "areaM2": 7.0
      },
      {
        "name": "客餐厅",
        "x": 0,
        "y": 3900,
        "w": 9600,
        "d": 2700,
        "areaM2": 25.9
      },
      {
        "name": "阳台",
        "x": 0,
        "y": 6600,
        "w": 5100,
        "d": 1500,
        "areaM2": 7.7
      }
    ],
    "roomCount": 7,
    "interiorTotalM2": 63.3
  },
  "plan": {
    "schemaVersion": 2,
    "meta": {
      "id": "tpl-apt-2br",
      "name": "两居室",
      "createdAt": 1790726400000,
      "updatedAt": 1790726400000,
      "unit": "mm",
      "displayUnit": "metric",
      "codeset": "cn",
      "template": "apt-2br"
    },
    "floors": [
      {
        "id": "f1",
        "name": "1F",
        "elevation": 0,
        "height": 2800,
        "slab": 200,
        "ceiling": 2800,
        "nodes": [
          {
            "id": "n1",
            "x": 0,
            "y": 0
          },
          {
            "id": "n2",
            "x": 3300,
            "y": 0
          },
          {
            "id": "n3",
            "x": 6000,
            "y": 0
          },
          {
            "id": "n4",
            "x": 7800,
            "y": 0
          },
          {
            "id": "n5",
            "x": 9600,
            "y": 0
          },
          {
            "id": "n6",
            "x": 6000,
            "y": 2400
          },
          {
            "id": "n7",
            "x": 7800,
            "y": 2400
          },
          {
            "id": "n8",
            "x": 0,
            "y": 3900
          },
          {
            "id": "n9",
            "x": 3300,
            "y": 3900
          },
          {
            "id": "n10",
            "x": 6000,
            "y": 3900
          },
          {
            "id": "n11",
            "x": 7800,
            "y": 3900
          },
          {
            "id": "n12",
            "x": 9600,
            "y": 3900
          },
          {
            "id": "n13",
            "x": 0,
            "y": 6600
          },
          {
            "id": "n14",
            "x": 5100,
            "y": 6600
          },
          {
            "id": "n15",
            "x": 9600,
            "y": 6600
          },
          {
            "id": "n16",
            "x": 0,
            "y": 8100
          },
          {
            "id": "n17",
            "x": 5100,
            "y": 8100
          }
        ],
        "walls": [
          {
            "id": "w1",
            "a": "n1",
            "b": "n2",
            "thickness": 240,
            "height": null,
            "bearing": false,
            "exterior": true,
            "demolished": false,
            "virtual": false,
            "finish": {
              "left": "paint-white",
              "right": "paint-white"
            }
          },
          {
            "id": "w2",
            "a": "n1",
            "b": "n8",
            "thickness": 240,
            "height": null,
            "bearing": false,
            "exterior": true,
            "demolished": false,
            "virtual": false,
            "finish": {
              "left": "paint-white",
              "right": "paint-white"
            }
          },
          {
            "id": "w3",
            "a": "n2",
            "b": "n3",
            "thickness": 240,
            "height": null,
            "bearing": false,
            "exterior": true,
            "demolished": false,
            "virtual": false,
            "finish": {
              "left": "paint-white",
              "right": "paint-white"
            }
          },
          {
            "id": "w4",
            "a": "n2",
            "b": "n9",
            "thickness": 120,
            "height": null,
            "bearing": false,
            "exterior": false,
            "demolished": false,
            "virtual": false,
            "finish": {
              "left": "paint-white",
              "right": "paint-white"
            }
          },
          {
            "id": "w5",
            "a": "n3",
            "b": "n4",
            "thickness": 240,
            "height": null,
            "bearing": false,
            "exterior": true,
            "demolished": false,
            "virtual": false,
            "finish": {
              "left": "paint-white",
              "right": "paint-white"
            }
          },
          {
            "id": "w6",
            "a": "n3",
            "b": "n6",
            "thickness": 120,
            "height": null,
            "bearing": false,
            "exterior": false,
            "demolished": false,
            "virtual": false,
            "finish": {
              "left": "paint-white",
              "right": "paint-white"
            }
          },
          {
            "id": "w7",
            "a": "n4",
            "b": "n5",
            "thickness": 240,
            "height": null,
            "bearing": false,
            "exterior": true,
            "demolished": false,
            "virtual": false,
            "finish": {
              "left": "paint-white",
              "right": "paint-white"
            }
          },
          {
            "id": "w8",
            "a": "n4",
            "b": "n7",
            "thickness": 120,
            "height": null,
            "bearing": false,
            "exterior": false,
            "demolished": false,
            "virtual": false,
            "finish": {
              "left": "paint-white",
              "right": "paint-white"
            }
          },
          {
            "id": "w9",
            "a": "n5",
            "b": "n12",
            "thickness": 240,
            "height": null,
            "bearing": false,
            "exterior": true,
            "demolished": false,
            "virtual": false,
            "finish": {
              "left": "paint-white",
              "right": "paint-white"
            }
          },
          {
            "id": "w10",
            "a": "n6",
            "b": "n7",
            "thickness": 120,
            "height": null,
            "bearing": false,
            "exterior": false,
            "demolished": false,
            "virtual": false,
            "finish": {
              "left": "paint-white",
              "right": "paint-white"
            }
          },
          {
            "id": "w11",
            "a": "n6",
            "b": "n10",
            "thickness": 120,
            "height": null,
            "bearing": false,
            "exterior": false,
            "demolished": false,
            "virtual": false,
            "finish": {
              "left": "paint-white",
              "right": "paint-white"
            }
          },
          {
            "id": "w12",
            "a": "n7",
            "b": "n11",
            "thickness": 120,
            "height": null,
            "bearing": false,
            "exterior": false,
            "demolished": false,
            "virtual": false,
            "finish": {
              "left": "paint-white",
              "right": "paint-white"
            }
          },
          {
            "id": "w13",
            "a": "n8",
            "b": "n9",
            "thickness": 120,
            "height": null,
            "bearing": false,
            "exterior": false,
            "demolished": false,
            "virtual": false,
            "finish": {
              "left": "paint-white",
              "right": "paint-white"
            }
          },
          {
            "id": "w14",
            "a": "n8",
            "b": "n13",
            "thickness": 240,
            "height": null,
            "bearing": false,
            "exterior": true,
            "demolished": false,
            "virtual": false,
            "finish": {
              "left": "paint-white",
              "right": "paint-white"
            }
          },
          {
            "id": "w15",
            "a": "n9",
            "b": "n10",
            "thickness": 120,
            "height": null,
            "bearing": false,
            "exterior": false,
            "demolished": false,
            "virtual": false,
            "finish": {
              "left": "paint-white",
              "right": "paint-white"
            }
          },
          {
            "id": "w16",
            "a": "n10",
            "b": "n11",
            "thickness": 120,
            "height": null,
            "bearing": false,
            "exterior": false,
            "demolished": false,
            "virtual": true,
            "finish": {
              "left": "paint-white",
              "right": "paint-white"
            }
          },
          {
            "id": "w17",
            "a": "n11",
            "b": "n12",
            "thickness": 120,
            "height": null,
            "bearing": false,
            "exterior": false,
            "demolished": false,
            "virtual": false,
            "finish": {
              "left": "paint-white",
              "right": "paint-white"
            }
          },
          {
            "id": "w18",
            "a": "n12",
            "b": "n15",